[INFO] Host      : g-04-01
[INFO] SLURM JOB : 80332
[INFO] GPU       : MIG-332bdf05-d4de-5e51-87da-13e92745bbb9
Fri Dec  5 17:07:02 2025       
+-----------------------------------------------------------------------------------------+
| NVIDIA-SMI 550.163.01             Driver Version: 550.163.01     CUDA Version: 12.4     |
|-----------------------------------------+------------------------+----------------------+
| GPU  Name                 Persistence-M | Bus-Id          Disp.A | Volatile Uncorr. ECC |
| Fan  Temp   Perf          Pwr:Usage/Cap |           Memory-Usage | GPU-Util  Compute M. |
|                                         |                        |               MIG M. |
|=========================================+========================+======================|
|   0  NVIDIA A30                     On  |   00000000:21:00.0 Off |                  Off |
| N/A   38C    P0             68W /  165W |      51MiB /  24576MiB |     N/A      Default |
|                                         |                        |              Enabled |
+-----------------------------------------+------------------------+----------------------+

+-----------------------------------------------------------------------------------------+
| MIG devices:                                                                            |
+------------------+----------------------------------+-----------+-----------------------+
| GPU  GI  CI  MIG |                     Memory-Usage |        Vol|      Shared           |
|      ID  ID  Dev |                       BAR1-Usage | SM     Unc| CE ENC DEC OFA JPG    |
|                  |                                  |        ECC|                       |
|==================+==================================+===========+=======================|
|  0    3   0   0  |              13MiB /  5952MiB    | 14    N/A |  1   0    1    0    0 |
|                  |                 0MiB /  8191MiB  |           |                       |
+------------------+----------------------------------+-----------+-----------------------+
                                                                                         
+-----------------------------------------------------------------------------------------+
| Processes:                                                                              |
|  GPU   GI   CI        PID   Type   Process name                              GPU Memory |
|        ID   ID                                                               Usage      |
|=========================================================================================|
|  No running processes found                                                             |
+-----------------------------------------------------------------------------------------+
+ /work/lxr240011/conda_envs/WiMANS/bin/python -u main_causal_residual_cpu_time_training_time.py

========== CAUSAL RUN: BUILDING | mode=BOTH | model=BOTH ==========


=== CAUSAL BUILDING | mode=BOTH | model=BOTH | epochs=1500 | eval_every=200 | rolls=[5, 10, 20] | out=results_CPU_TIME_building_both/artifacts_causal_building_both_both ===
[building] Using T_expected=120 scans/RP
[building] Using AP indices from coords: [1, 2, 3, 4, 5, 6, 7, 8, 9, 10, 11, 12, 13]
[building] Adding rolling stats for mode='both' with windows=[5, 10, 20]
/work/lxr240011/conda_envs/WiMANS/lib/python3.10/site-packages/torch/nn/utils/weight_norm.py:28: UserWarning: torch.nn.utils.weight_norm is deprecated in favor of torch.nn.utils.parametrizations.weight_norm.
  warnings.warn("torch.nn.utils.weight_norm is deprecated in favor of torch.nn.utils.parametrizations.weight_norm.")

[ptflops] Input shape (T,N,F): [120, 13, 38]
[ptflops] Params: 93,934
[ptflops] MACs  : 33.50M
[ptflops] FLOPs : 67.01M  (≈ 2 × MACs)

[ptflops] Saved: results_CPU_TIME_building_both/artifacts_causal_building_both_both/model_complexity_ptflops.txt
[EVAL] CAUSAL building | both | both | epoch=0200 | RF-RMSE=1.712 m
[EVAL] CAUSAL building | both | both | epoch=0400 | RF-RMSE=1.166 m
[EVAL] CAUSAL building | both | both | epoch=0600 | RF-RMSE=0.841 m
[EVAL] CAUSAL building | both | both | epoch=0800 | RF-RMSE=0.806 m
[EVAL] CAUSAL building | both | both | epoch=1000 | RF-RMSE=0.659 m
[EVAL] CAUSAL building | both | both | epoch=1200 | RF-RMSE=0.624 m
[EVAL] CAUSAL building | both | both | epoch=1400 | RF-RMSE=0.568 m
[EVAL] CAUSAL building | both | both | epoch=1500 | RF-RMSE=0.660 m
[TRAIN] building | both | both | 1500 epochs took 37.66 min (2259.7 s)
[CPU-TIME] threads=1 | avg per sequence (RP) = 2.5465 ms, per scan = 0.0212 ms (T=120, n_runs=100)

=== FINAL SUMMARY (building, both, both) ===
{'env': 'building', 'feature_mode': 'both', 'model_type': 'both', 'rf_rmse': 0.6602432727813721, 'N_AP': 13, 'grid_m': 0.6, 'T_used': 120, 'feat_dim': 38, 'causal': True, 'cpu_ms_per_seq': 2.546467836946249, 'cpu_ms_per_scan': 0.02122056530788541, 'params': 93934, 'macs': 33503880.0, 'flops': 67007760.0, 'train_seconds': 2259.6529844310135, 'train_minutes': 37.66088307385022, 'train_min_per_epoch': 0.025107255382566813, 'epochs': 1500, 'roll_windows': '[5, 10, 20]'}

Results saved under: results_CPU_TIME_building_both
+ set +x
[DONE] Finished main_causal_residual_cpu_time_training_time.py
